<?xml version="1.0"?>
<!--
To change this license header, choose License Headers in Project Properties.
To change this template file, choose Tools | Templates
and open the template in the editor.
-->
<!-- -->
<xs:schema elementFormDefault="qualified"
           xmlns:xs="http://www.w3.org/2001/XMLSchema">
    <xs:element name="RaccoltaCD">
        <xs:complexType>
            <xs:sequence>
                <xs:element name="CD" maxOccurs="unbounded">
                    <xs:complexType>
                        <xs:sequence>
                            <xs:element name="ID">
                                <xs:simpleType>
                                    <xs:restriction base="xs:int">
                                        <xs:minExclusive value="0"></xs:minExclusive>
                                    </xs:restriction>
                                </xs:simpleType>
                            </xs:element>
                            <xs:element name="Autore" default="Nessuno" maxOccurs="1">
                                <xs:simpleType>
                                    <xs:restriction base="xs:string">
                                        <xs:maxLength value="50"></xs:maxLength>
                                        <xs:minLength value="2"></xs:minLength>
                                    </xs:restriction>
                                </xs:simpleType>
                            </xs:element>
                            <xs:element name="Titolo" maxOccurs="1">
                                <xs:simpleType>
                                    <xs:restriction base="xs:string">
                                        <xs:maxLength value="50"></xs:maxLength>
                                        <xs:minLength value="2"></xs:minLength>
                                    </xs:restriction>
                                </xs:simpleType>
                            </xs:element>
                            <xs:element name="Brano" maxOccurs="101">
                                <xs:simpleType>
                                    <xs:restriction base="xs:string">
                                        <xs:maxLength value="50"></xs:maxLength>
                                        <xs:minLength value="1"></xs:minLength>
                                    </xs:restriction>
                                </xs:simpleType>
                            </xs:element>                           
                        </xs:sequence>
                    </xs:complexType>
                </xs:element>
            </xs:sequence>
        </xs:complexType>
    </xs:element>

</xs:schema>
